{
  "$schema": "https://json-schema.org/draft/2020-12/schema",
  "$id": "urn:gondola-lyrics:kit-rules:v1",
  "title": "kit-rules rule set",
  "description": "Shared rule data for language-specific kits. Store rule words without configured whitespace. Consumers remove that whitespace from matching input and apply ASCII case normalization to both input and rule words while preserving source credit labels and names. Consumers check unique group IDs and alias conflicts, and perform model changes. Node kits may statically import the JSON with Vite.",
  "type": "object",
  "additionalProperties": false,
  "required": ["$schema", "version", "language", "normalization", "groups"],
  "properties": {
    "$schema": {
      "type": "string",
      "const": "../schema.json",
      "description": "Relative reference to the shared repository schema."
    },
    "version": {
      "type": "integer",
      "const": 1,
      "description": "Rule format version. Consumers accept only versions they support."
    },
    "language": {
      "type": "string",
      "pattern": "^[a-z]{2,8}(-[a-z0-9]{1,8})*$",
      "description": "Lowercase text language tag. Use the same tag in the corresponding filename.",
      "examples": ["zh-hans", "en"]
    },
    "normalization": {
      "$ref": "#/$defs/normalization"
    },
    "groups": {
      "type": "array",
      "minItems": 1,
      "description": "A file contains one group type. Groups keep a fixed order; words are ordered from high to low matching priority, so consumers may stop at the first word that matches. Consumers check that group IDs and normalized words are unique within the file."
    }
  },
  "oneOf": [
    {
      "title": "Credit rule file",
      "description": "Split a full line at its first ASCII or fullwidth colon. Remove configured whitespace from the role-label copy, apply ASCII case normalization, and compare it with compact rule words for whole-string equality. Name separators are consumer options. Preserve source labels and names; a label without a valid name does not produce a credit.",
      "type": "object",
      "properties": {
        "normalization": {
          "type": "object",
          "properties": {
            "whitespace": {
              "const": "remove"
            }
          }
        },
        "groups": {
          "type": "array",
          "items": {
            "$ref": "#/$defs/creditGroup"
          }
        }
      }
    },
    {
      "title": "Filter rule file",
      "description": "Remove configured whitespace from a matching-text copy before applying filter conditions. This makes separated and compact spellings equivalent. Categories identify text; consumer options decide whether to remove a lyric line.",
      "type": "object",
      "properties": {
        "normalization": {
          "type": "object",
          "properties": {
            "whitespace": {
              "const": "remove"
            }
          }
        },
        "groups": {
          "type": "array",
          "items": {
            "$ref": "#/$defs/filterGroup"
          }
        }
      }
    }
  ],
  "$defs": {
    "normalization": {
      "title": "Match normalization",
      "type": "object",
      "additionalProperties": false,
      "required": ["whitespace", "case"],
      "description": "Normalize matching copies only; stored rule words contain no configured whitespace. The whitespace set is U+0009..U+000D, U+0020, U+0085, U+00A0, U+1680, U+2000..U+200A, U+2028, U+2029, U+202F, U+205F, U+3000, and U+FEFF. All implementations process the same code points.",
      "properties": {
        "whitespace": {
          "type": "string",
          "const": "remove",
          "description": "Remove every configured whitespace character from matching input. Both credit and filter rules use remove; preserve the original source text."
        },
        "case": {
          "type": "string",
          "const": "asciiLower",
          "description": "Lowercase ASCII A through Z only. Preserve every other character and avoid platform-default locale rules."
        }
      }
    },
    "groupId": {
      "type": "string",
      "pattern": "^[a-z][a-z0-9]*(-[a-z0-9]+)*$",
      "description": "Stable group identifier using lowercase letters, digits, and hyphens."
    },
    "words": {
      "type": "array",
      "minItems": 1,
      "uniqueItems": true,
      "description": "Compact literal words without duplicate items or configured whitespace, ordered from high to low matching priority. Consumers apply ASCII case normalization to stored words and check alias conflicts across groups.",
      "items": {
        "type": "string",
        "minLength": 1,
        "not": {
          "pattern": "[\\u0009-\\u000D\\u0020\\u0085\\u00A0\\u1680\\u2000-\\u200A\\u2028\\u2029\\u202F\\u205F\\u3000\\uFEFF]"
        }
      }
    },
    "creditRole": {
      "type": "string",
      "enum": ["OTHER", "LYRICIST", "COMPOSER", "ARRANGER", "PRODUCER", "PERFORMER", "MIXER", "MASTERING"],
      "description": "Current model CreditRole symbol. Each implementation maps it explicitly instead of relying on enum numbers."
    },
    "creditGroup": {
      "title": "Credit group",
      "type": "object",
      "additionalProperties": false,
      "required": ["id", "roles", "kind", "words"],
      "properties": {
        "id": {
          "$ref": "#/$defs/groupId"
        },
        "roles": {
          "type": "array",
          "minItems": 1,
          "uniqueItems": true,
          "items": {
            "$ref": "#/$defs/creditRole"
          },
          "description": "A label may resolve to multiple roles, such as LYRICIST and COMPOSER for a combined credit."
        },
        "kind": {
          "type": "string",
          "enum": ["role", "instrument"],
          "description": "role identifies a credit responsibility; instrument identifies an instrument credit. Consumers perform metadata updates."
        },
        "words": {
          "$ref": "#/$defs/words"
        }
      }
    },
    "filterMatch": {
      "type": "string",
      "enum": ["contains", "whole"],
      "description": "contains finds any case-normalized rule word as a substring of whitespace-free matching text without word-boundary checks. whole requires the complete matching text to equal a rule word under the same case policy. Using whole for Cover does not match Discover."
    },
    "filterGroup": {
      "title": "Filter group",
      "type": "object",
      "additionalProperties": false,
      "required": ["id", "category", "match", "words"],
      "properties": {
        "id": {
          "$ref": "#/$defs/groupId"
        },
        "category": {
          "type": "string",
          "pattern": "^[a-z][a-z0-9]*(-[a-z0-9]+)*$",
          "description": "Identification category using lowercase letters, digits, and hyphens. The category does not prescribe a deletion action.",
          "examples": ["copyright", "adaptation", "disclaimer"]
        },
        "match": {
          "$ref": "#/$defs/filterMatch"
        },
        "words": {
          "$ref": "#/$defs/words"
        }
      }
    }
  }
}
