{
  "$schema": "../schema.json",
  "version": 1,
  "language": "zh-hans",
  "normalization": {
    "whitespace": "remove",
    "case": "asciiLower"
  },
  "groups": [
    {
      "id": "performer",
      "roles": ["PERFORMER"],
      "kind": "role",
      "words": [
        "演唱",
        "主唱",
        "原唱",
        "翻唱",
        "合唱",
        "和声",
        "和音",
        "伴唱",
        "配唱",
        "唱",
        "合声",
        "合音",
        "童声",
        "男声",
        "女声",
        "人声",
        "腔",
        "配音",
        "念白",
        "旁白",
        "对白",
        "说唱",
        "演奏者",
        "乐手",
        "乐师",
        "现场乐队",
        "乐队",
        "乐团",
        "人声打击",
        "口技",
        "独奏",
        "伴奏"
      ]
    },
    {
      "id": "lyricist",
      "roles": ["LYRICIST"],
      "kind": "role",
      "words": ["作词", "填词", "歌词", "中文词", "英文词", "词", "RAP词"]
    },
    {
      "id": "composer",
      "roles": ["COMPOSER"],
      "kind": "role",
      "words": ["作曲", "谱曲", "曲"]
    },
    {
      "id": "arranger",
      "roles": ["ARRANGER"],
      "kind": "role",
      "words": ["编曲", "配器", "管弦乐编排", "弦乐编写", "管乐编写", "节奏编写", "合唱编写", "和声编写", "和音编写"]
    },
    {
      "id": "producer",
      "roles": ["PRODUCER"],
      "kind": "role",
      "words": [
        "制作人",
        "制作",
        "单曲制作",
        "执行制作人",
        "执制",
        "协力制作人",
        "共同制作",
        "共同制作人",
        "制作协力",
        "人声制作人",
        "人声制作",
        "创意制作人"
      ]
    },
    {
      "id": "other",
      "roles": ["OTHER"],
      "kind": "role",
      "words": [
        "录音师",
        "录音工程师",
        "客串",
        "特邀",
        "台词",
        "主创",
        "作",
        "编",
        "协力",
        "节拍制作",
        "节拍制作人",
        "节拍",
        "编调",
        "编程",
        "人声指导",
        "工程师",
        "工程",
        "音响工程师",
        "音响",
        "声工",
        "录音",
        "录制",
        "分轨",
        "杜比全景声",
        "混音助理",
        "录音助理",
        "母带助理",
        "后期",
        "后期制作",
        "修音师",
        "修音",
        "调校",
        "调教",
        "人声编辑",
        "音频编辑",
        "编辑",
        "剪辑",
        "预制作",
        "创意总监",
        "声音设计师",
        "音效设计",
        "音效",
        "声音",
        "声设",
        "拟音师",
        "拟音",
        "监制",
        "音乐总监",
        "监",
        "指挥",
        "艺人与产品",
        "艺人统筹",
        "艺人",
        "录音室经理",
        "录音室",
        "录音棚",
        "助理工程师",
        "助工",
        "助理",
        "跟踪工程师",
        "电脑工程师",
        "电脑",
        "乐谱",
        "谱",
        "抄谱员",
        "抄谱",
        "扒谱员",
        "扒谱",
        "乐谱管理员",
        "谱务",
        "乐器技师",
        "吉他技师",
        "鼓技师",
        "音控师",
        "调音师",
        "调音",
        "前台工程师",
        "监听工程师",
        "监听",
        "舞台",
        "舞台监督",
        "舞台总监",
        "灯光师",
        "企划",
        "策划",
        "项目统筹",
        "统筹",
        "项目",
        "项目策划",
        "出品",
        "出品人",
        "出品方",
        "联合",
        "联合出品方",
        "发行",
        "发布",
        "厂牌",
        "公司",
        "唱片",
        "唱片公司",
        "制作公司",
        "宣传",
        "推广",
        "宣发",
        "宣推",
        "营销",
        "版权",
        "视觉设计",
        "视觉",
        "设计",
        "封面",
        "海报",
        "插画",
        "曲绘",
        "图绘",
        "映像",
        "封",
        "美工",
        "美术",
        "摄影",
        "摄像",
        "视频",
        "分镜",
        "脚本",
        "导演",
        "艺术顾问",
        "艺术",
        "顾问",
        "题字",
        "文案",
        "翻译",
        "译",
        "支持",
        "鸣谢",
        "特约嘉宾",
        "指导",
        "承办单位",
        "承办",
        "承办人",
        "单位",
        "业务",
        "策监",
        "经纪",
        "数字编辑",
        "数字剪辑",
        "次级发行",
        "次级发行方",
        "分发行",
        "音乐制作助理",
        "制作助理",
        "混音工作室",
        "混音室",
        "混音录音室",
        "版权运营",
        "企宣",
        "企划宣传",
        "艺人助理",
        "平面视觉",
        "平面设计",
        "平面",
        "首席运营官",
        "花絮",
        "妆发",
        "妆造",
        "服装",
        "造型",
        "物料",
        "承制",
        "资产管理",
        "短视频",
        "短视频平台",
        "OP",
        "原版权",
        "原始版权",
        "SP",
        "次级版权",
        "辅助监督",
        "监督",
        "PGM",
        "Program",
        "编程播放",
        "音序",
        "母带处理录音室",
        "母带录音室",
        "筹划"
      ]
    },
    {
      "id": "mixer",
      "roles": ["MIXER"],
      "kind": "role",
      "words": ["混音师", "混音工程师", "混音", "贴混", "混", "重混音师"]
    },
    {
      "id": "mastering",
      "roles": ["MASTERING"],
      "kind": "role",
      "words": ["母带工程师", "母带制作", "母带后期", "母带", "母带处理制作人", "母带制作人"]
    },
    {
      "id": "instruments",
      "roles": ["PERFORMER"],
      "kind": "instrument",
      "words": [
        "吉他",
        "贝斯",
        "钢琴",
        "键盘",
        "鼓手",
        "架子鼓",
        "弦乐",
        "管乐",
        "乐器",
        "乐器独奏",
        "所有乐器",
        "所有乐器演奏",
        "全部乐器",
        "中国笛",
        "电钢琴",
        "风琴",
        "哈蒙德风琴",
        "大键琴",
        "合成器",
        "合成贝斯",
        "采样器",
        "采样",
        "序列器",
        "电吉他",
        "木吉他",
        "箱琴",
        "指弹吉他",
        "尤克里里",
        "电贝斯",
        "低音吉他",
        "乌德琴",
        "班卓琴",
        "西塔琴",
        "鲁特琴",
        "曼陀林",
        "弦",
        "提琴",
        "小提",
        "小提琴",
        "中提",
        "中提琴",
        "大提",
        "大提琴",
        "低音提琴",
        "竖琴",
        "铜管",
        "木管",
        "笛子",
        "竹笛",
        "长笛",
        "短笛",
        "班苏里笛",
        "哨笛",
        "单簧管",
        "竖笛",
        "低音单簧管",
        "双簧管",
        "英国管",
        "巴松",
        "大管",
        "萨克斯",
        "小号",
        "短号",
        "长号",
        "大号",
        "圆号",
        "次中音号",
        "富鲁格号",
        "富鲁格",
        "打击乐",
        "鼓",
        "电子鼓",
        "打击垫",
        "电子打击垫",
        "定音鼓",
        "蒂姆巴尔鼓",
        "铃鼓",
        "康加鼓",
        "邦戈鼓",
        "钹",
        "镲",
        "锣",
        "沙锤",
        "三角铁",
        "响板",
        "钟琴",
        "木琴",
        "马林巴",
        "颤音琴",
        "古琴",
        "瑶琴",
        "玉琴",
        "古筝",
        "琵琶",
        "二胡",
        "扬琴",
        "阮",
        "中阮",
        "箫",
        "笛萧",
        "洞萧",
        "笙",
        "唢呐",
        "巴乌",
        "葫芦丝",
        "手风琴",
        "六角手风琴",
        "口琴",
        "特雷门琴",
        "拇指琴",
        "钢片琴",
        "电子琴",
        "转盘",
        "MIDI编程",
        "克拉维奈",
        "梅洛特隆",
        "口风琴",
        "肩背键盘",
        "声码器",
        "簧风琴",
        "踏板钢弦吉他",
        "滑棒吉他",
        "谐振吉他",
        "十二弦吉他",
        "布祖基",
        "恰朗戈",
        "巴拉莱卡",
        "德西马",
        "齐特琴",
        "自动竖琴",
        "手摇琴",
        "键提琴",
        "拉巴卜",
        "柳琴",
        "月琴",
        "三弦",
        "高胡",
        "中胡",
        "板胡",
        "京胡",
        "箜篌",
        "埙",
        "大阮",
        "小阮",
        "排箫",
        "排笛",
        "筝",
        "三味线",
        "太鼓",
        "尺八",
        "伽倻琴",
        "奚琴",
        "大笒",
        "长鼓",
        "马头琴",
        "迪吉里杜管",
        "风笛",
        "杜杜克",
        "陶笛",
        "锡笛",
        "卡洪",
        "木箱鼓",
        "非洲鼓",
        "金贝鼓",
        "塔布拉",
        "达布卡",
        "手碟",
        "钢鼓",
        "说话鼓",
        "波德兰鼓",
        "管钟",
        "编钟",
        "牛铃",
        "木棒",
        "刮壶",
        "木鱼",
        "小鼓",
        "军鼓",
        "手鼓",
        "框鼓",
        "班多钮"
      ]
    },
    {
      "id": "lyrics-and-composition",
      "roles": ["LYRICIST", "COMPOSER"],
      "kind": "role",
      "words": ["词曲", "词曲创作"]
    }
  ]
}
